{"$schema":"https://json-schema.org/draft/2020-12/schema","$id":"https://thekey.local/schemas/checkmate-review-receipt-v1.json","title":"CheckmateReviewReceipt v1","type":"object","additionalProperties":false,"required":["schema_version","protocol_version","receipt_id","reviewer_id","run_id","transaction_id","plan_sha256","verdict","issued_at"],"properties":{"schema_version":{"const":"v1"},"protocol_version":{"const":"v1"},"receipt_id":{"type":"string","minLength":3,"maxLength":128},"reviewer_id":{"type":"string","minLength":3,"maxLength":128},"run_id":{"type":"string","minLength":3,"maxLength":128},"transaction_id":{"type":"string","minLength":3,"maxLength":128},"plan_sha256":{"type":"string","pattern":"^(?!0{64}$)[0-9a-f]{64}$"},"verdict":{"enum":["PASS","DEFER","FAIL","PENDING"]},"issued_at":{"type":"string","format":"date-time"}}}
